{
  "$schema": "https://json-schema.org/draft/2020-12/schema",
  "title": "Devotions JSON Array",
  "type": "array",
  "minItems": 1,
  "items": {
    "type": "object",
    "properties": {
      "date": { "type": "string", "format": "date", "pattern": "^\\d{4}-\\d{2}-\\d{2}$" },
      "quote": { "type": "string" },
      "quoteCitation": { "type": "string" },
      "firstReading": { "type": "string" },
      "secondReading": { "type": "string" },
      "psalmSummary": { "type": "string" },
      "gospelSummary": { "type": "string" },
      "dailyPrayer": { "type": "string" },
      "saintReflection": { "type": "string" },
      "theologicalSynthesis": { "type": "string" },
      "exegesis": { "type": "string" },

      "usccbLink": { "type": "string" },
      "cycle": { "type": "string" },
      "weekdayCycle": { "type": "string" },
      "feast": { "type": "string" },
      "gospelReference": { "type": "string" },
      "firstReadingRef": { "type": "string" },
      "secondReadingRef": { "type": "string" },
      "psalmRef": { "type": "string" },
      "gospelRef": { "type": "string" },
      "lectionaryKey": { "type": "string" },
      "tags": {
        "type": "array",
        "items": { "type": "string" }
      }
    },
    "required": [
      "date",
      "quote",
      "quoteCitation",
      "firstReading",
      "secondReading",
      "psalmSummary",
      "gospelSummary",
      "dailyPrayer",
      "saintReflection",
      "theologicalSynthesis",
      "exegesis",
      "usccbLink",
      "cycle",
      "weekdayCycle",
      "feast",
      "gospelReference",
      "firstReadingRef",
      "secondReadingRef",
      "psalmRef",
      "gospelRef",
      "lectionaryKey",
      "tags"
    ],
    "additionalProperties": false
  }
}
