{"date":"2026-08-31","quote":"I resolved to know nothing except Jesus Christ crucified","quoteCitation":"Corinthians 2: 1-5","firstReading":"Paul tells the Corinthians that when he came he did not rely on lofty rhetoric or human wisdom but proclaimed only Jesus Christ and him crucified. He explains that he came in weakness, fear, and trembling, and that his preaching depended not on persuasive words but on the power of the Spirit, so that the believers’ faith would rest on God’s power rather than on human wisdom.","secondReading":"","psalmSummary":"These verses praise the beauty and benefit of God’s law. The psalmist delights in God’s commandments, finding wisdom greater than enemies and teachers. He meditates on the precepts, gains understanding beyond his elders, and rejects any crooked path. The law gives joy and counsel; the psalmist clings to God’s statutes, finding steady guidance and life amid opposition.","gospelSummary":"Jesus returns to Nazareth and, as was his custom, reads from the prophet Isaiah in the synagogue. He proclaims the passage as fulfilled in their hearing, announcing God’s favor and release. Initially the congregation marvels at his words and wonders at his gracious speech, but their admiration turns when he challenges local expectations by citing God’s care for outsiders in Elijah’s and Elisha’s times. Offended, they drive him out of town and attempt to hurl him from a cliff, yet Jesus passes through the crowd and goes on his way.","saintReflection":"Saints Joseph of Arimathea and Nicodemus (Saint of the Day): Saints Joseph of Arimathea and Nicodemus were respected Jewish leaders who showed courage and reverence in caring for the body of Jesus after the Crucifixion. Their discipleship moved from hidden seeking toward public tenderness at a moment of danger. They remind believers that love for Christ may begin quietly, but grace eventually calls it into visible fidelity.","dailyPrayer":"Lord Jesus, you come to us without glittering rhetoric but with the power of the Spirit. Give us the humility to know only you and the courage to live and speak your truth amid weakness and fear. As the psalmist delights in your law, teach us to treasure your word and order our steps by it. Inspire hearts like Joseph of Arimathea and Nicodemus to move private devotion into acts of visible care. When neighbors reject your message, grant us patience and resolve to continue your work. May our faith rest not on human persuasion but on your saving power, that we may serve with reverence and compassion. Help us recognize your presence in the poor and unexpected places and to bear witness to your fulfilled promises. Amen.\n\nStrengthen our leaders in wisdom and mercy; bless those who bury the dead or tend the wounded. Through the Spirit, transform our timid loyalty into concrete service and charity, so that your name may be glorified in our community and beyond. Amen.","theologicalSynthesis":"Paul’s insistence that he proclaimed only 'Jesus Christ crucified' (1 Cor 2) grounds Christian proclamation in the paradox of power through weakness. The psalmist’s delight in the law shows how Scripture forms the believer’s heart, providing wisdom that exceeds human teachers. In Luke, Jesus claims Isaiah’s promises and provokes Nazareth by revealing God’s mercy extending beyond expectations, a prophetic challenge to narrow tribal privilege. Joseph and Nicodemus embody this movement from private devotion to public fidelity, risking status to honor Christ’s body. The readings together teach that authentic witness flows from Scripture-shaped humility, the Spirit’s power, and concrete acts of love that may unsettle communities. This dynamic calls the Church to nurture formation that fuses doctrinal fidelity with charitable risk, to preach with simplicity and to serve with sacrifice. Only then will communities witness Christ fulfilled among them.","exegesis":"Context: The first reading (Corinthians 2:1-5) comes from Paul’s opening defense in a church beset by rival claims to wisdom and status. Paul deliberately rejects rhetorical flourish and human persuasion, insisting that his ministry centers on the crucified Christ and the Spirit’s power. This posture addresses a community tempted to evaluate ministry by eloquence, social standing, or philosophical acumen. Paul wants faith to rest on God’s power, not on human showmanship. His words are pastoral and polemical: pastoral because they protect the integrity of the Gospel, polemical because they correct a mistaken communal standard for authority.\n\nPsalm: Psalm 119:97-102 celebrates the formative influence of God’s law and teaching. The psalmist’s delight in the commandments and meditation upon them cast the Scriptures as the source of true wisdom and moral formation. Against those who might rely on status or cunning, the psalm affirms that long attentiveness to God’s word yields understanding surpassing human teachers and resistance to crooked paths. The portrait is of a learner whose interior life—meditation, love of law, steady obedience—shapes conduct and anchors trust in God rather than in human persuasion.\n\nGospel: Luke 4:16-30 places Jesus in Nazareth claiming fulfillment of Isaiah’s prophecy. The synagogue scene is a test: Jesus reads of release for the poor and recovery of sight, then declares, 'Today this Scripture is fulfilled in your hearing.' The crowd initially marvels, but Jesus’ subsequent citations of Elijah and Elisha—prophetic acts of mercy shown to outsiders—expose local expectations and prick nationalist pride. The response moves from admiration to fury, culminating in an attempted lynching. The episode highlights how prophetic witness both offers consolation and disrupts complacent belonging when divine mercy breaks boundaries.\n\nSaints: Joseph of Arimathea and Nicodemus, as recorded in the Gospel tradition and reflected in the saint profile, enact a quiet but decisive fidelity. Both men, respected in Jewish circles, move from cautious discipleship to public tenderness in tending Jesus’ body. Their actions reflect the trajectory seen across the readings: private reverence, shaped by Scripture and conscience, becomes public sacrifice. They model how devotion that dwells on Christ and Scripture can issue in costly service rather than rhetorical display, aligning sacramental care with doctrinal fidelity.\n\nTheology: The theological center that threads these texts is the priority of God’s power and word over human eloquence and social capital. Paul’s paradox—strength through weakness—echoes Isaiah’s hope for liberation and the psalmist’s confidence in law. Luke’s narrative shows that claiming God’s favor often unsettles entrenched expectations; true fulfillment of Scripture confronts and redirects communal loyalties. The saints’ actions exemplify how Scripture-formed hearts respond: not with argument to win popularity but with sacrificial acts that embody the gospel. The Spirit authenticates such witness, making apparent that faith rests on divine action rather than human persuasion.\n\nToday: For contemporary communities the readings are corrective and challenging. Churches tempted to measure effectiveness by charisma, numbers, or rhetorical polish are called back to the substance of the Gospel: Christ crucified and the Spirit’s power. The psalm invites daily formation in Scripture so that love and wisdom govern judgment. The Nazareth scene warns that prophetic proclamation may provoke rejection when it calls for justice beyond familiar boundaries. The examples of Joseph and Nicodemus encourage believers to translate interior devotion into concrete care, even at cost. Practically, this means preaching with humility, forming disciples in Scripture and prayer, and risking reputation to serve the vulnerable—so that Christian witness rests on God, not our applause.","tags":["saints-joseph-of-arimathea-and-nicodemus","saints","saints-joseph-of-arimathea-and-n","faith","scripture","humility","proclamation","discipleship","courage"],"usccbLink":"https://bible.usccb.org/bible/readings/083126.cfm","cycle":"Year A","weekdayCycle":"Cycle II","feast":"Saint of the Day","gospelReference":"Luke 4: 16-30","firstReadingRef":"1 Corinthians 2: 1-5","secondReadingRef":"","psalmRef":"Psalms 119: 97, 98, 99, 100, 101, 102","gospelRef":"Luke 4: 16-30","lectionaryKey":"2026-08-31:1 Corinthians 2: 1-5||Psalms 119: 97, 98, 99, 100, 101, 102|Luke 4: 16-30"}
