{"date":"2026-09-02","quote":"He laid hands on each and healed them immediately.","quoteCitation":"Luke 4:40 (USCCB)","firstReading":"Paul addresses the Corinthians as immature in faith because of factionalism and quarrelling. He rebukes their jealousy and spiritual infancy, noting they still walk like mere humans. Ministers are God’s servants: Paul planted, Apollos watered, but God gives the growth. No servant should boast against another, for each will receive wages according to the Lord’s gift. The community is God’s field and building; ministers are coworkers working together under God’s providence.","secondReading":"","psalmSummary":"The psalm praises the blessedness of the people whose God is the LORD, who watches over all creation. God shapes human hearts and sees all their deeds; nothing escapes divine attention. The faithful wait with hope on the LORD, for he alone is our help and shield. Trusting in his holy name, the community rejoices and finds security in God’s providential care.","gospelSummary":"After leaving the synagogue, Jesus goes to Simon’s house and finds Simon’s mother-in-law ill with a fever; he heals her, and she immediately begins to serve them. At sunset many bring the sick and demon-possessed, and Jesus lays his hands on each and heals them. He withdraws to pray alone. When the crowds search for him, he declares that he must preach the kingdom of God to other towns as well, continuing his mission of proclamation and healing throughout Judea.","saintReflection":"Saint Zeno and His Sons (Commemoration): Saint Zeno and his sons, Concordius and Theodore, are remembered in Christian tradition as martyrs at Nicomedia during the reign of Julian the Apostate. Their story comes through an ancient account of martyrdom rather than a detailed surviving biography, so their witness is best understood through the faith for which they are honored. Together they confessed that allegiance to Christ could not be surrendered under coercion. Their remembrance illuminates Jesus' teaching that the disciple must acknowledge him before others and entrust even mortal life to the Father (Matthew 10:28–33). Such courage is not a glorification of suffering or death; it is confidence that the risen Christ has overcome death. Their witness invites the Church to pray for perseverance, to support those persecuted for their faith, and to remember that baptismal communion with Christ calls for steadfast love without hatred of one's enemies.","dailyPrayer":"Lord God, you who give growth and watch over all creation, grant us humility in ministry and unity within the Body of Christ. Teach us to work as your coworkers rather than rivals, that our efforts may bear fruit according to your will. Grant healing and compassion to those who suffer, and strengthen us to serve them in love. As Jesus withdrew to pray, help us to find time for quiet prayer that renews our mission. Send us forth to proclaim your kingdom with courage and gentleness. Keep our hope fixed on you, our help and shield, and form our hearts to trust your providence. Through Christ our Lord. Amen.","theologicalSynthesis":"These readings converge on two complementary theological themes: God’s sovereignty over growth and the proper posture of those who serve in his mission. Paul stresses that ministers are collaborators; human leaders plant and water but only God gives growth. The psalm reinforces God’s providential oversight—he shapes hearts, watches all deeds, and is the faithful help of his people. The Gospel shows that Jesus’ mission unites word and deed: proclamation and healing flow together, sustained by prayer. The faithful are called to humility, cooperative service, trust in divine providence, and persistent prayerful evangelization, recognizing that ministry is God’s work accomplished through human servants.","exegesis":"Context: Paul writes to the Corinthian congregation wrestling with divisions and competing loyalties. In 1 Corinthians 3:1–9 he diagnoses their spiritual immaturity as jealousy and factionalism rooted in worldly thinking. The immediate context is pastoral: Paul must re-orient the community’s self-understanding away from attachment to particular leaders and toward a corporate identity grounded in God’s singular work. The passage reframes ministry as stewardship; ministers are temporary agents who contribute to a process whose outcome belongs to God. His language—planting, watering, field, building—moves the community from personality-driven allegiance to a teambased theology of vocation.\n\nPsalm: Psalm 33:12–15, 20–21 forms a theological backdrop centered on divine providence and the blessedness of a people whose God is the LORD. The psalmist affirms that God not only sustains creation but actively shapes human hearts and watches their actions. Trust in God yields security: he is both help and shield. Read alongside Paul, the psalm invites the community to abandon human boasting and find confidence in God’s oversight rather than in human leaders, knowing that ultimate flourishing comes from the Lord who governs growth and guards his own.\n\nGospel: Luke 4:38–44 narrates a compact episode in which Jesus heals Simon Peter’s mother-in-law, cures many at sunset, and then retreats to pray before continuing to preach elsewhere. The sequence highlights three elements of Jesus’ ministry: compassionate healing, personal devotion in prayer, and itinerant proclamation. Healing elicits immediate service; personal prayer replenishes mission; preaching extends the kingdom beyond one locale. Luke thereby models for ministers a balance: attentive care for the suffering, interior communion with the Father, and faithful proclamation to broader horizons.\n\nSaints: Saint Zeno and his sons, Concordius and Theodore, are remembered in Christian tradition as martyrs whose shared confession expresses fidelity to Christ. Their remembrance illuminates Paul's insistence that the Church belongs to God rather than to competing human leaders: communion rests in Christ, not in rivalry or claims of spiritual superiority. The psalm calls the faithful to trust God's merciful care, and the Gospel shows Jesus joining healing with the proclamation of God's kingdom. The martyrs' witness invites perseverance in that same faith, not hostility toward those who oppose it. Their commemoration calls the Church to unity, prayer for the persecuted, and steadfast love grounded in the resurrection.\n\nToday: For contemporary congregations the texts address persistent pastoral challenges. Factionalism and leader-centered loyalties hinder witness and obscure God’s action. Paul’s corrective insists that ministries be seen as collaborative and subordinate to God’s sovereign care. The psalm’s trustful orientation helps communities resist anxiety and control, while Luke’s account advocates a ministry shaped by compassion and replenished by prayer. Practically, leaders must cultivate mutual respect, prioritize pastoral care for the vulnerable, and model spiritual practices that sustain sustained mission beyond local acclaim.\n\nApplication: Pastors, parish staffs, and lay leaders should hear three concrete summons. First, reorder priorities from personal recognition toward cooperative stewardship: evaluate ministries by fruitfulness in advancing God’s reign, not by publicity or rivalry. Second, integrate care and proclamation: ensure pastoral programs attend both corporal needs and evangelization. Third, recover rhythms of prayer that ground ministry in dependence on God rather than on human abilities. In doing so, communities embody the theological vision: co-workers under God, entrusted with a field that belongs ultimately to the Lord who alone gives the growth.","tags":["saint-zeno-and-his-sons","saints","unity","ministry","healing","prayer","mission","providence","stewardship"],"usccbLink":"https://bible.usccb.org/bible/readings/090226.cfm","cycle":"Year A","weekdayCycle":"Cycle II","feast":"","gospelReference":"Luke 4:38-44","firstReadingRef":"1 Corinthians 3:1-9","secondReadingRef":"","psalmRef":"Psalm 33:12-13, 14-15, 20-21","gospelRef":"Luke 4:38-44","lectionaryKey":"2026-09-02:1 Corinthians 3:1-9||Psalm 33:12-13, 14-15, 20-21|Luke 4:38-44"}
