{"date":"2026-10-27","quote":"The kingdom of God is like a mustard seed.","quoteCitation":"Luke 13:18","firstReading":"Paul begins with mutual submission out of reverence for Christ and then addresses wives and husbands within marriage. Wives are called to receive their husbands in the Lord; husbands are commanded to love as Christ loved the Church, giving himself for her holiness. Marriage discloses a great mystery: the covenantal union of Christ and the Church, marked by self-giving love, fidelity, and sanctification.","secondReading":"","psalmSummary":"Psalm 128 blesses the one who fears the Lord and walks in his ways. Such reverence bears fruit in ordinary household life: labor is blessed, the wife is fruitful within the home, and children surround the table with life and promise. The psalm concludes by invoking the Lord’s blessing from Zion, linking family flourishing with worship and the peace of Jerusalem.","gospelSummary":"Jesus teaches through the images of a mustard seed and yeast. The kingdom does not first appear through outward grandeur or force. Like a very small seed planted in a garden, it grows until it becomes a sheltering tree. Like yeast hidden in flour, it quietly works through the whole measure of dough. These parables reveal God’s reign as a divine work that begins humbly, enters what is ordinary, and brings hidden yet real transformation. The disciple is therefore called to trust God’s patient power, even when the beginnings of faith, holiness, or mission seem small.","saintReflection":"Saint Frumentius (Commemoration): Saint Frumentius (fourth century) became a formative missionary bishop in the kingdom of Aksum. According to ancient accounts, he and his companion Aedesius reached the Ethiopian court after surviving violence during a voyage. Entrusted with responsibilities there, Frumentius encouraged Christian communities and later sought episcopal leadership from Saint Athanasius of Alexandria, who consecrated him bishop. Ethiopian tradition honors him as Abuna Salama, the Father of Peace. His life shows the Gospel taking root through providence, patient relationship, sacramental communion, and the emergence of a truly local Church. Mission is not possession by an outside culture; it serves the growth of faith within a people under the Holy Spirit. Frumentius invites respect for the ancient Christianity of Africa, perseverance in unexpected circumstances, and commitment to ecclesial communion across languages and nations.","dailyPrayer":"Lord Jesus Christ, you love your Church and gave yourself to make her holy. Purify our hearts from every form of domination, selfishness, and indifference, and teach us the mutual submission that springs from reverence for you. Bless spouses with faithful, sacrificial love, and strengthen families to live under your mercy and peace.\n\nPlant the seed of your kingdom within us. When faith appears small, keep us steadfast; when your work is hidden, keep us trusting. As yeast transforms the dough, let your grace permeate our words, our homes, our parish, and all our service of the Gospel.\n\nThrough the intercession of Saint Frumentius, grant your Church a deeper love for communion across peoples and nations. Bless the ancient Churches of Africa, sustain all who announce Christ in difficult circumstances, and raise up pastors who lead with humility and fidelity to apostolic faith. May we welcome your providence, remain united to the Church, and bear fruit for your kingdom. Amen.","theologicalSynthesis":"Today’s readings present the kingdom as communion made fruitful by Christ. Ephesians does not offer a worldly arrangement of power; it places marriage beneath the lordship of Jesus, beginning with mutual submission in reverence for him. The husband’s measure is Christ’s self-offering for the Church, while the whole passage points beyond itself to the nuptial mystery of Christ and his redeemed people.\n\nPsalm 128 receives household life as a blessing flowing from fear of the Lord. This reverence is worshipful obedience, not anxiety. It gathers labor, marriage, children, Zion, and peace into the gracious order of God’s covenant.\n\nIn Luke, the kingdom grows from what appears slight and concealed. Saint Frumentius embodies this pattern: Christian communities were encouraged, episcopal communion was sought, and the faith took root in Aksum as a local Church. The Gospel’s growth is neither cultural possession nor human display. The Holy Spirit forms one catholic Church among distinct peoples, sanctifying them in Christ while preserving their genuine particularity.","exegesis":"Context: Ephesians 5:21-33 belongs to Paul’s instruction on the new life received in Christ. Immediately before this passage, believers are exhorted to be filled with the Spirit, giving thanks to God and living in worship. Mutual submission is therefore not an isolated social rule but a fruit of belonging to Christ. The passage then addresses marriage within this larger ecclesial and baptismal horizon. Its governing confession is that Jesus is Lord and that his body, the Church, receives life, holiness, and salvation from him. Any reading that separates the passage from this Christological center misses its deepest purpose.\n\nContext: Paul speaks to wives and husbands, but the longest and most demanding exhortation is directed to husbands. Their love is measured by Christ’s love for the Church: a love that gives itself, sanctifies, nourishes, and cherishes. Christ does not preserve himself at the expense of his bride; he offers himself for her redemption. The passage thus excludes harshness, self-assertion, and the reduction of marriage to private preference. Marriage is ordered toward a communion in which each spouse is received as belonging to the Lord. Paul joins the creation word about the two becoming one flesh to the great mystery of Christ and the Church. Human marriage is consequently a real sign that points toward the covenantal love of the Savior.\n\nPsalm: Psalm 128 answers this mystery with the biblical vision of blessing. To fear the Lord is to stand before God in adoration, obedience, and trust. The psalm describes the blessed person enjoying the fruit of labor, the fruitfulness of family life, and the blessing that comes from Zion. These are not guarantees that the righteous will be spared every suffering. Rather, they testify that all created goods find their proper meaning when received from God and ordered toward his peace. The table, the household, and the city are not closed worlds. They are related to Zion, the place of God’s worship and blessing. Christian prayer hears this psalm in the light of the Church, where God gathers his people and gives them peace through Christ.\n\nGospel: The parables of the mustard seed and yeast reveal the manner of God’s reign. Jesus does not deny the kingdom’s final greatness; the mature tree provides an image of breadth and shelter. Yet he directs attention to its beginning: a tiny seed sown in a garden and a small portion of yeast mixed into flour. God acts in ways that can be overlooked by those seeking immediate spectacle. The kingdom is truly present in Christ, but its growth unfolds through time, conversion, proclamation, sacramental life, holiness, and charity. The yeast is hidden, but it is not inactive; its effect reaches the whole dough. So too, grace penetrates human life from within. The disciple must not despise small beginnings, nor presume to control the kingdom’s growth. The proper response is faithfulness to the One who gives the increase.\n\nSaints: Saint Frumentius gives a fitting witness to this Gospel pattern. According to ancient accounts, difficult and unexpected circumstances brought him and Aedesius to the Ethiopian court. There Frumentius encouraged Christian communities. His later appeal to Saint Athanasius for episcopal leadership shows that the growth of the faith was inseparable from ecclesial communion and sacramental order. Consecrated bishop by Athanasius, Frumentius served the emergence of a Church rooted in Aksum. Ethiopian tradition honors him as Abuna Salama, the Father of Peace. His witness cautions against imagining mission as the extension of an outside culture. The Gospel is catholic because Christ gathers peoples into one Church; it is also truly at home among peoples, whose local Churches receive and confess the apostolic faith under the guidance of the Holy Spirit.\n\nToday: The readings call the Church to contemplate the form of Christ’s power. It is self-giving rather than self-protective, patient rather than impatient, and fruitful even when hidden. Spouses may renew their awareness that marriage belongs to Christ and is called to reflect his holy love for the Church. Families may ask whether their common life is rooted in the fear of the Lord and joined to the worship of the Church. All believers may recognize that the kingdom often advances through acts that seem small: steadfast prayer, reverent participation in the sacraments, patient forgiveness, and faithful witness. Through Saint Frumentius, we also learn to honor the ancient Christian inheritance of Africa and to cherish communion among Churches across languages and nations. The seed is Christ’s kingdom; the growth is God’s gift; the Church is called to serve that growth in humble fidelity.","tags":["saint-frumentius","saints","ephesians","marriage","christ-and-the-church","kingdom-of-god","mission","ethiopian-christianity","ordinary-time"],"usccbLink":"https://bible.usccb.org/bible/readings/102726.cfm","cycle":"Year A","weekdayCycle":"Cycle II","feast":"Commemoration","gospelReference":"Luke 13:18-21","firstReadingRef":"Ephesians 5:21-33","secondReadingRef":"","psalmRef":"Psalms 128:1-2, 3, 4-5","gospelRef":"Luke 13:18-21","lectionaryKey":"2026-10-27:Ephesians 5:21-33||Psalms 128:1-2, 3, 4-5|Luke 13:18-21"}
