{
  "date": "2025-09-10",
  "quote": "Blessed are you who are poor, for yours is the kingdom of God.",
  "quoteCitation": "Luke 6:20-26",
  "firstReading": "Paul summons Christians to live from their resurrection identity in Christ. If you have been raised with him, set your minds on heavenly realities and discard earthly attachments. He calls believers to put to death sinful habits — anger, malice, dishonesty — and to strip off the old self. Instead, put on the new self, renewed in knowledge and formed in the image of the Creator, where Christ is the unifying center of identity and community.",
  "secondReading": "",
  "psalmSummary": "Psalm 145 is a song of praise celebrating God's kingship, compassion, and faithfulness. It affirms that God’s works are worthy of continual praise and that all generations will proclaim them. The psalm emphasizes God’s nearness to those in need, attentiveness to the suffering, and steadfast provision. In short, it presents a God whose enduring reign cares for the lowly and sustains creation with faithful love.",
  "gospelSummary": "Luke’s Beatitudes turn worldly expectations upside down: those who are poor, hungry, and weeping are called blessed because God’s reign is present to them, promising inheritance, satisfaction, and consolation. Jesus contrasts these blessings with woes against the rich, the well-fed, and the socially secure, warning that present comforts can bring spiritual loss. The passage calls disciples to solidarity with the vulnerable, to trust God rather than wealth, and to live with courage and hope in the face of social marginalization because God will ultimately vindicate the faithful.",
  "saintReflection": "No specific saint is named today, yet the readings invite every Christian to a practical holiness. Sainthood here means waking daily to the resurrection, choosing compassion over comfort, and letting go of status. Ordinary acts — telling the truth, forgiving, feeding the hungry, weeping with those who mourn — form the saintly life. Teens and adults alike are challenged to let their identity in Christ shape small, concrete choices that witness to God’s kingdom.",
  "dailyPrayer": "Lord Jesus, you bless the poor and promise comfort to those who mourn. Teach us to seek the life that rises with you. Free us from attachments to wealth, status, and selfish habits that keep us earthbound. Put to death in us what harms others and ourselves; clothe us in your mercy, truth, and compassion. Help us recognize and stand with those who hunger and grieve. Give us courage to live countercultural love at school, work, and home, and patience to trust your justice. Fill us with your Spirit so our inner renewal bears outward fruit. Keep our hearts fixed on your kingdom until we share fully in your glory. Amen.",
  "theologicalSynthesis": "The readings weave together an invitation to interior transformation and communal commitment. Paul instructs believers to root identity in Christ’s resurrection, rejecting old patterns and adopting a renewed self. Luke shows how that inner change reorders social priorities: the kingdom embraces the poor and promises future reversal for the complacent rich. The psalm grounds both in praise of a God who is near and faithful to the vulnerable. Theologically, holiness here is not escapist spirituality but a Christ-shaped formation that moves from heart to action: seeking heavenly things leads to solidarity with the lowly and trust in God’s final vindication. Thus discipleship becomes both personal renewal and public mercy.",
  "exegesis": "Context: Paul writes to a diverse Colossian church wrestling with cultural pressures that pull believers toward worldly identities. In calling Christians to set their minds on what is above, he offers a corrective to spiritual confusion: the resurrection of Christ reshapes how we think and live. The contrast between the 'old self' and the 'new self' signals not merely moral instruction but an ontological reorientation — people who are now defined by Christ. This is pastoral advice for communities trying to hold together amid social and ideological differences.\n\nPsalm: The psalm functions as a lyrical backdrop, offering praise language that clarifies God’s character. It celebrates a sovereign yet tender ruler who ‘works wonders’ and who is intimately attentive to the human condition. The repeated affirmation of God’s compassion and nearness reassures those who are poor or suffering that divine power is not distant luxury but active care. The psalm’s emphasis on God’s enduring kingdom echoes both Paul’s call to heavenly-mindedness and Luke’s promise of vindication.\n\nGospel: Luke’s Beatitudes are a prophetic proclamation of a reversal. Jesus names as blessed those whom society often overlooks — the poor, hungry, mourners — and names woes for the comfortable and celebrated. This is not merely future consolation; it is an announcement that God's rule has begun to break into history on behalf of the marginalized. Luke stresses social implication: to follow Jesus is to embody solidarity and to refuse the moral complacency that accompanies wealth and security.\n\nSaints: Though no single saint appears in these readings, the idea of sainthood emerges organically. Saints are those who live the resurrection reality Paul describes and the Beatitudinal ethic Luke proclaims. That means ordinary believers who choose humility over pride, truth over deception, and generosity over accumulation. Saints practice small acts of mercy and witness that God's kingdom values differ from dominant cultural metrics of success. Community life is the laboratory where new identity in Christ is tested and strengthened.\n\nToday: For contemporary readers — teens, students, workers, parents — these texts demand concrete choices. Setting the mind on 'things above' looks like resisting consumerism, speaking truth in relationships, and standing with those who suffer. The Beatitudes challenge us to evaluate who we bless and ignore in daily life. The psalm's assurance of God’s nearness brings comfort when social marginalization wounds us. Practically, discipleship involves liturgical memory (praise), inner conversion (putting off the old self), and public solidarity (feeding, mourning, advocating) so that the kingdom becomes visible in ordinary acts of love.",
  "tags": [],
  "usccbLink": "https://bible.usccb.org/bible/readings/091025.cfm",
  "cycle": "Year C",
  "weekdayCycle": "Cycle I",
  "feast": "",
  "gospelReference": "Luke 6:20-26",
  "firstReadingRef": "Colossians 3:1-11",
  "secondReadingRef": "",
  "psalmRef": "Psalm 145:2-3, 10-11, 12-13",
  "gospelRef": "Luke 6:20-26",
  "lectionaryKey": "Colossians3:1-11|Psalm145:2-3,10-11,12-13|Luke6:20-26|Year C|Cycle I"
}
