{"date":"2026-10-05","quote":"You shall love the Lord, your God, with all your heart.","quoteCitation":"Luke 10:27","firstReading":"Paul confronts the Galatians because they are quickly turning from the God who called them through Christ’s grace to a distorted message. He insists that there is only one Gospel and warns that no preacher, even an angel, can alter it. Paul’s concern is not human approval but fidelity to Christ, whose revelation authorizes his apostolic preaching.","secondReading":"","psalmSummary":"Psalm 111 praises the Lord for works that reveal holiness, justice, faithfulness, and redemption. God’s deeds are trustworthy and enduring; his precepts stand firm. The psalm joins grateful worship to reverent fear of the Lord, teaching that true wisdom begins in humble awe before God and takes shape in obedience to his covenant.","gospelSummary":"A scholar of the law asks Jesus what is necessary for eternal life and then seeks to limit the command to love one’s neighbor. Jesus answers with the parable of the man robbed and left suffering on the road. A priest and a Levite pass by, but a Samaritan is moved with compassion. He approaches the wounded man, tends his injuries, brings him to safety, and provides for his continued care. Jesus reverses the question: the issue is not identifying the boundaries of who deserves love, but becoming a neighbor through merciful action. The scholar recognizes that the merciful man fulfilled the law’s demand, and Jesus commands him to imitate that mercy.","saintReflection":"Saint Faustina Kowalska and Blessed Francis Xavier Seelos (Optional Memorials): Saint Faustina Kowalska (1905–1938), a Polish Sister of Our Lady of Mercy, and Blessed Francis Xavier Seelos (1819–1867), a Redemptorist priest who served in the United States, are remembered through optional memorials on this date. Faustina's diary bears witness to Christ's mercy as a summons to trust, repentance, sacramental life, and mercy toward others; authentic devotion to Divine Mercy never separates confidence in forgiveness from conversion. Seelos served immigrant communities through preaching, reconciliation, spiritual counsel, and care for the sick, eventually dying after ministering during a yellow-fever epidemic. Their distinct lives converge in the merciful heart of Christ. They teach that mercy is first received as grace and then embodied in patient charity, forgiveness, and attention to suffering. Their witness calls the faithful to approach Christ without despair and to become instruments of the compassion they celebrate.","dailyPrayer":"Merciful Lord Jesus, draw us into the truth of your Gospel and preserve us from every teaching that obscures your grace. Give us the reverent fear that is the beginning of wisdom, so that we may receive your commandments as the path of life and freedom.\n\nWhen we encounter suffering, deliver us from indifference. Form in us the compassionate heart revealed in the Samaritan, ready to draw near, to serve patiently, and to persevere in care. Teach us to receive your mercy with sincere repentance, especially through reconciliation, and to extend forgiveness as those whom you have forgiven.\n\nThrough the intercession of Saint Faustina Kowalska and Blessed Francis Xavier Seelos, strengthen all who minister to the sick, the wounded, the forgotten, and those burdened by sin or despair. May their witness lead us to trust your merciful heart, to love you wholly, and to become faithful neighbors to those you place before us. Amen.","theologicalSynthesis":"The readings unite the integrity of the Gospel with the concrete practice of mercy. Paul teaches that the Gospel is not subject to revision according to human preference: it is the saving revelation of Jesus Christ, received in grace and proclaimed in truth. The psalm responds with worship, recognizing that God’s works and commandments are faithful and enduring.\n\nIn the Gospel, Jesus shows that love of God and love of neighbor cannot be separated. The Samaritan’s compassion is not sentiment alone; it becomes bodily, costly, persevering care for a suffering person. This mercy reflects the divine mercy believers first receive from God. It does not abolish conversion or the moral law; rather, grace fulfills the law by forming hearts capable of charity.\n\nSaint Faustina and Blessed Francis Xavier Seelos direct the Church toward this same mystery. Trust in Christ’s mercy leads to repentance, sacramental life, forgiveness, and compassionate service. Fidelity to the one Gospel is therefore made visible when disciples refuse indifference and become neighbors to those in need.","exegesis":"Context: Galatians opens with Paul’s urgent astonishment that the Christians of Galatia are turning away from the God who called them through Christ’s grace. The danger is not a harmless difference of emphasis but a distortion of the Gospel itself. Paul speaks with unusual severity because salvation rests upon God’s gift in Christ, not upon a message reshaped to satisfy religious pressure or human approval. His repeated condemnation of anyone who proclaims a contrary gospel underscores the Church’s obligation to receive apostolic faith faithfully. Paul does not present himself as the source of this truth. His authority is bound to the revelation of Jesus Christ, and his ministry seeks the Lord’s approval rather than praise from others.\n\nPsalm: Psalm 111 supplies the proper response to revealed truth: praise, reverence, and obedient understanding. God’s works are great, righteous, and dependable; his precepts are established in truth and equity. The psalm’s wisdom is not merely intellectual attainment. Fear of the Lord means worshipful acknowledgment of God’s holiness and a readiness to live under his covenant. This reverence protects believers from the instability Paul confronts in Galatia. Those who contemplate God’s redeeming deeds learn that his command is not arbitrary. It flows from the faithful Lord who has acted for his people and who remains worthy of trust. Wisdom therefore joins doctrine, worship, and a life shaped by God’s enduring word.\n\nGospel: The scholar’s question about eternal life receives an answer rooted in the law: wholehearted love of God and love of neighbor. Yet his further question seeks a boundary. He asks whom he is obliged to regard as neighbor, as though charity could be confined to a defined circle. Jesus responds not with an abstract definition but with a story of a wounded man abandoned on the road. The priest and Levite, despite their religious standing, do not provide the necessary aid. Jesus does not explain their motives. The parable instead directs attention to the visible fact that the afflicted man remains unattended until another traveler stops.\n\nGospel: The Samaritan is the one moved by compassion, and his mercy takes concrete forms. He approaches the injured man, treats him, carries him to a place of shelter, and arranges for continued care. The care is neither distant nor momentary. By making the Samaritan the exemplary neighbor, Jesus overturns the scholar’s effort to restrict love according to social or religious categories. The decisive question becomes whether the disciple will act as neighbor to the person in need. Jesus’ final command makes mercy an imperative for those who seek eternal life. Love of God, confessed in the law, must become active love of the suffering person encountered along the way.\n\nSaints: Saint Faustina Kowalska’s witness illuminates the Gospel’s source: mercy begins in the merciful heart of Christ. Her devotion calls believers to confidence in forgiveness, but never to presumption. Trust is joined to repentance, sacramental life, and mercy toward others. Blessed Francis Xavier Seelos likewise manifested pastoral charity through preaching, reconciliation, spiritual counsel, and care for the sick. His service among immigrant communities and his final ministry during a yellow-fever epidemic show mercy expressed in attention to persons facing suffering. Their lives do not add another gospel to Paul’s proclamation. Rather, they witness to the grace of Christ received in faith and embodied in charity.\n\nToday: The readings summon the Church to hold together truth and mercy. Fidelity to the apostolic Gospel cannot become harshness toward the wounded, nor can appeals to mercy detach forgiveness from conversion and the truth Christ reveals. The Christian receives God’s mercy as grace, approaches the Lord in repentance, and then becomes a neighbor through patient acts of compassion. The Samaritan’s example asks whether believers notice suffering that lies before them and whether their love perseveres beyond an initial response. With the psalmist, the Church praises the Lord whose redemption and commandments endure. With Paul, she guards the Gospel. With Christ, she learns that merciful love is the path by which his disciples make visible the life they have received.","tags":["saint-faustina-kowalska-and-blessed-francis-xavier-seelos","saints","saint-faustina-kowalska-and-bles","galatians","divine-mercy","good-samaritan","christian-charity","saint-faustina-kowalska","blessed-francis-xavier-seelos","monday-of-the-twenty-seventh-wee"],"usccbLink":"https://bible.usccb.org/bible/readings/100526.cfm","cycle":"Year A","weekdayCycle":"Cycle II","feast":"Optional Memorials","gospelReference":"Luke 10:25-37","firstReadingRef":"Galatians 1:6-12","secondReadingRef":"","psalmRef":"Psalms 111:1-2, 7-8, 9, 10","gospelRef":"Luke 10:25-37","lectionaryKey":"2026-10-05:Galatians 1:6-12||Psalms 111:1-2, 7-8, 9, 10|Luke 10:25-37"}
