{"date":"2026-10-07","quote":"Lord, teach us to pray just as John taught his disciples.","quoteCitation":"Luke 11:1","firstReading":"Paul recounts his visit to Jerusalem, undertaken in response to revelation, where he presented the Gospel he proclaimed among the Gentiles. The recognized leaders perceived that God had entrusted Paul with ministry to the uncircumcised, as Peter served the circumcised. Yet at Antioch Paul publicly opposed Cephas when fear of the circumcision party led him to withdraw from table fellowship with Gentile believers.","secondReading":"","psalmSummary":"Psalm 117 summons every nation and people to praise the Lord. Its universality accords with Paul’s defense of the Gospel’s reach among the Gentiles: God’s covenant love is not the possession of one people alone. The psalm grounds praise in the Lord’s enduring mercy and faithfulness, inviting the whole human family into worship.","gospelSummary":"After Jesus finishes praying, a disciple asks him to teach them to pray. Jesus gives the prayer by which his disciples approach God as Father. It begins with reverence for God’s holy name and desire for his kingdom, then asks for daily bread, forgiveness, and deliverance from temptation. The prayer joins worship and petition: disciples depend upon the Father for bodily sustenance, receive mercy by forgiving others, and seek protection amid the testing that threatens fidelity. Jesus forms a praying people whose life is ordered to God’s reign.","saintReflection":"Our Lady of the Rosary (Memorial): The Memorial of Our Lady of the Rosary honors the Blessed Virgin Mary while directing the Church to contemplate the mysteries of Christ. In the Rosary, repeated biblical prayer creates space for meditation on the Incarnation, ministry, Passion, Resurrection, and glory of Jesus. Mary's role is always Christological: she receives the word in faith, gives flesh to the eternal Son, accompanies him to the Cross, and prays with the disciples awaiting the Spirit. The Rosary is therefore not a flight from Scripture or the liturgy but a school of recollection that can deepen participation in both. Its rhythm joins the prayer of the lips to the attention of the heart. This memorial invites perseverance in prayer, receptivity to grace, and imitation of Mary's obedient faith, so that contemplation of Christ may lead to faithful discipleship and charity.","dailyPrayer":"Father most holy, we come before you through your Son, who teaches his disciples to pray and draws them into his own filial trust. Hallow your name in us, and let your kingdom take root in your Church and throughout the world. Give us today the bread we need: the nourishment of your word, the grace of the sacraments, and all that sustains us in faithful service.\n\nForgive our sins, and free our hearts from resentment, so that we may extend to others the mercy we continually receive from you. Guard us in trial, preserve us from the deceits that divide your people, and make us steadfast in the truth of the Gospel.\n\nThrough the intercession of the Blessed Virgin Mary, Our Lady of the Rosary, teach us to ponder the mysteries of Christ with reverence. May prayer lead us to obedience, charity, and communion in your Son, who lives and reigns with you in the unity of the Holy Spirit, God forever and ever. Amen.","theologicalSynthesis":"Today’s readings unite the Church’s prayer with the Church’s communion in the one Gospel. Jesus teaches disciples to address God as Father, placing the holiness of God’s name and the coming of his kingdom before every petition. Such prayer is never merely private: those who say Father are gathered into a people reconciled by divine mercy and summoned to forgive one another.\n\nPaul shows how seriously this communion must be guarded. The Gospel entrusted to the apostles embraces Gentiles as Gentiles through the grace of Christ; therefore conduct that separates believers at table can obscure the truth of that Gospel. Ecclesial unity cannot be preserved by practices that deny the reconciliation God has accomplished.\n\nPsalm 117 gives this reconciliation its horizon: every people is called to praise the Lord for enduring mercy. On the memorial of Our Lady of the Rosary, Mary teaches contemplative fidelity. Her prayer directs the Church to her Son, whose mysteries disclose the Father’s mercy, establish communion among believers, and form them for persevering discipleship.","exegesis":"Context: Galatians 2 presents Paul’s apostolic ministry as received from God and tested within the communion of the Church. He goes to Jerusalem in response to revelation and lays before the acknowledged leaders the Gospel he proclaims among the Gentiles. His concern is not uncertainty about the Gospel’s source, but the need that his labor not be frustrated by division or false teaching. The passage holds together divine initiative and ecclesial recognition. The same God active in Peter’s apostolate to the circumcised is active in Paul’s mission among the Gentiles. The leaders’ recognition confirms that the one Gospel bears fruit in distinct fields of mission.\n\nContext: The Antioch incident reveals that communion must be lived truthfully, especially at the Lord’s table and in shared fellowship. Cephas had eaten with Gentile Christians, but later withdrew when persons associated with circumcision arrived. Paul judges this conduct publicly because it endangered the Gospel’s truth. The issue is not mere courtesy or differing custom. Christ has reconciled Jew and Gentile, and no observance can become a barrier that implies Gentile believers stand at a lesser distance from God. Paul’s correction shows that apostolic fellowship includes fraternal accountability when behavior obscures the grace proclaimed by the Church.\n\nPsalm: The brief psalm supplies the proper horizon for Galatians: all nations and all peoples are summoned to praise the Lord. Israel’s Scriptures themselves direct worship outward toward the nations, because the Lord’s mercy is powerful and his faithfulness endures. This is not an erasure of Israel’s election, nor a dismissal of God’s covenantal gifts. Rather, the Lord’s faithfulness reaches its intended fullness as the nations are gathered to glorify him. The psalm’s universal invitation accords with the apostolic mission recognized in Jerusalem and enacted amid the tensions of Antioch.\n\nGospel: Luke places the Lord’s Prayer after Jesus himself has been praying. The disciples do not receive a religious technique detached from him; they are admitted into the prayer of the Son. To call God Father is possible because Jesus brings his disciples into filial relationship with the One he knows as Father. The first petitions order every subsequent desire: God’s name is to be held holy, and his kingdom is to come. Christian prayer begins with adoration and hope for God’s saving reign, not with the assertion of human preference.\n\nGospel: The remaining petitions express creaturely dependence and covenantal conversion. Daily bread is sought from God, teaching disciples to receive life as gift. Forgiveness is asked by those who also forgive, not as though mercy were earned, but because those transformed by the Father’s mercy must not refuse it to others. The final plea asks preservation amid testing, acknowledging human weakness and the need for God’s protecting grace. Thus the prayer forms a community marked by worship, trust, mercy, and perseverance. It heals the divisions exposed in Galatians by teaching believers to stand together as forgiven children before one Father.\n\nSaints: On the Memorial of Our Lady of the Rosary, the Church contemplates Christ with Mary, whose whole life is receptive to the Father’s saving word. The Rosary’s repeated biblical prayer does not compete with the prayer taught by Jesus or with the Church’s liturgy. It disposes the heart to dwell upon the mysteries in which the Son reveals the Father’s name, accomplishes reconciliation, and pours out the Spirit. Mary’s obedient faith is a pattern of discipleship: she receives grace, remains near her crucified Son, and prays among the disciples awaiting the Spirit. Her maternal intercession directs the Church always toward Christ.\n\nToday: These readings call believers to let prayer shape visible communion. The Our Father forbids a piety that seeks forgiveness while nurturing exclusion or contempt. Paul’s witness warns that even respected leaders need correction when actions cloud the Gospel of grace. Psalm 117 widens the Church’s praise to every people, while the Rosary trains attention on Christ’s saving mysteries. Today, disciples may ask for the grace to speak and act in ways consistent with the reconciliation God has given in Christ: reverencing the Father, receiving daily gifts with gratitude, forgiving readily, resisting temptation, and welcoming all whom the Lord gathers into his one Church.","tags":["our-lady-of-the-rosary","saints","rosary","prayer","galatians","the-lord's-prayer","church-communion","mary","gospel"],"usccbLink":"https://bible.usccb.org/bible/readings/100726.cfm","cycle":"Year A","weekdayCycle":"Cycle II","feast":"Memorial","gospelReference":"Luke 11:1-4","firstReadingRef":"Galatians 2:1-2, 7-14","secondReadingRef":"","psalmRef":"Psalms 117:1, 2","gospelRef":"Luke 11:1-4","lectionaryKey":"2026-10-07:Galatians 2:1-2, 7-14||Psalms 117:1, 2|Luke 11:1-4"}
