{"date":"2026-09-09","quote":"Blessed are you who are poor, for yours is the kingdom.","quoteCitation":"Luke 6:20 (USCCB)","firstReading":"In 1 Corinthians 7:25–31 Paul addresses those unmarried during the present ‘distress,’ advising that, in light of urgent circumstances, they may remain as they are so as to serve the Lord without divided anxieties. Marriage and worldly ties are treated as legitimate but secondary; social arrangements are ephemeral. Paul emphasizes the transitory nature of present life and calls Christians to live with the Lord’s perspective, prioritizing fidelity to Christ over absorption in worldly concerns.","secondReading":"","psalmSummary":"Psalm 45:11–12, 14–15, 16–17 addresses a royal bride and celebrates her dignity, beauty, and honored standing beside the king. The psalm evokes royal marriage imagery—princes stand ready, the bride is led and adorned—and calls her to forget her people and home as she takes on a new covenantal role. The psalmist also prays that her name be remembered and praised within the nation, linking personal honor to the flourishing of God’s house.","gospelSummary":"Luke 6:20–26 presents a striking set of beatitudes and corresponding woes. Jesus pronounces blessings on the poor, the hungry, those who weep, and the persecuted, promising the kingdom, satisfaction, comfort, and a great reward in heaven. He then issues woes against the rich, the well-fed, those who laugh now, and those praised by others, warning that current comforts may be reversed. Luke’s formulation emphasizes social reversal: God’s reign elevates the lowly and judges complacent privilege, calling disciples to solidarity with the vulnerable and fidelity amid opposition.","saintReflection":"Saint Peter Claver (Memorial): Saint Peter Claver (1580–1654), a Jesuit priest from Spain, spent his ministry in Cartagena among Africans subjected to the brutality of the slave trade. He met arriving ships, attended to immediate bodily needs, and offered instruction in the faith and sacramental care. His ministry placed the suffering person, rather than social status, at the center of his attention. The theological principle is fundamental: every human being possesses dignity as God's creature, and Baptism unites people of every nation in the one Body of Christ. His care can be read alongside Jesus' identification with the vulnerable in Matthew 25 and Paul's teaching that all are one in Christ (Galatians 3:28). Claver's witness invites a conversion that refuses indifference to dehumanization. Reverence for Christ requires mercy toward those who suffer and a faith expressed through patient, concrete service.","dailyPrayer":"Lord Jesus, you who opened your blessing to the poor and the sorrowing, grant us hearts that see human dignity in every face. Through the intercession of Saint Peter Claver, inflame our charity so that we tend to both the immediate needs and the spiritual care of those who suffer. Free us from complacency and the distractions of worldly gain; make us courageous in comforting the afflicted and patient in offering instruction and sacramental consolation. Unite us more deeply in Baptism to all your people, that our service become a sign of your kingdom. Help us to resist dehumanization wherever it appears and to work for justice with reverence and mercy. Amen.","theologicalSynthesis":"The readings shape a common summons: discipleship orders life toward the reign of God rather than worldly comfort. Paul’s counsel to live unentangled by worldly anxieties highlights urgency and undivided service to the Lord. The Psalm’s royal-marriage imagery recalls covenantal dignity and public remembrance bestowed by God. Luke’s beatitudes turn human values upside down, promising God’s kingdom to the poor and warning the complacent rich. Saint Peter Claver’s ministry embodies this vision: he placed the suffering person at the center, treating every baptized person as a member of Christ’s Body. The theological through-line is baptismal dignity and merciful service—faith that recognizes Christ in the vulnerable and acts concretely to uphold their human and sacramental worth.","exegesis":"Context: Paul’s brief exhortation in 1 Corinthians 7:25–31 must be read within his broader pastoral concern for those living in a time he calls the “present distress.” He does not lay down an absolute rule but offers pragmatic guidance: to remain as one is can better secure undivided attention to the Lord. For Paul, the Christian’s horizon is shaped by eschatological urgency. Marriage and social relationships remain honorable, yet they carry obligations that can distract from serving Christ amid pressing circumstances. The passage insists on a freedom of heart that places fidelity to the Lord’s purposes above status or temporal advantage.\n\nPsalm: Psalm 45’s selected verses employ nuptial and courtly language to celebrate honor and beauty within a royal context. Addressed to a bride, the psalm anticipates her entry into a new household and the public acknowledgment of her name. The royal marriage becomes a locus for covenantal identity: to be taken into the court is to be remembered and praised. The psalm thus affirms personal dignity tied to divine blessing and communal remembrance, underscoring how God’s favor lifts up those entrusted to his care.\n\nGospel: Luke 6:20–26 frames Jesus’ teaching by announcing blessings upon the poor, hungry, those who mourn, and the persecuted, paired with woes against the complacent and prosperous. Luke’s formulation stresses social reversal: God’s reign vindicates the lowly and exposes the danger of worldly security. Each beatitude promises not merely consolation but an eschatological reward—“the kingdom,” “satisfied,” “comforted,” “a great reward in heaven.” The corresponding woes function as prophetic warnings, calling the hearer to solidarity with those on the underside of society and fidelity that will cost the disciple persecution.\n\nSaints: Saint Peter Claver’s ministry in Cartagena gives concreteness to these scriptural dynamics. His care for Africans trafficked in slavery placed immediate, embodied service at the center: meeting ships, tending wounds, administering sacraments, and offering catechesis. Claver’s witness enacts the beatitudinal preference for the poor and the Pauline insistence on living for the Lord rather than worldly gain. The theological principle emphasized in his life—that every person bears inalienable dignity as God’s creature and that Baptism unites people of every nation in Christ’s Body—translates scriptural truth into pastoral praxis. His ministry invites conversion from indifference, insisting that reverence for Christ requires mercy toward those who suffer.\n\nToday: The convergence of these readings and Saint Peter Claver’s example challenges contemporary Christians in concrete ways. The Gospel’s reversal of values asks the Church to measure success not by wealth or reputation but by fidelity to the poor and persecuted. Paul’s counsel warns against allowing present comforts to undermine single-minded service to the Lord. The Psalm’s affirmation of public honor points toward a sacramental and communal remembering of those whom society would forget. Practically, this means prioritizing pastoral outreach, sacramental care, and advocacy for those dehumanized by structures of exploitation. The Christian response is not an abstract sentiment but a sustained, patient, and sacramental involvement in the lives of the vulnerable.\n\nConclusion: Together the texts and Saint Peter Claver’s life form a coherent summons: live with an eschatological horizon, honor the dignity of every baptized person, and let mercy guide concrete service. The Church’s vocation is to embody the beatitudes, to remember and praise those brought into God’s covenant, and to resist complacency when human dignity is denied. Such fidelity is at once theological—grounded in Baptism and the kingdom—and eminently practical, realized in patient, sacramental care for those who suffer.","tags":["saint-peter-claver","saints","ordinary-time","beatitudes","mercy","dignity-of-the-human-person","social-justice","pauline-ethics"],"usccbLink":"https://bible.usccb.org/bible/readings/090926.cfm","cycle":"Year A","weekdayCycle":"Cycle II","feast":"Memorial","gospelReference":"Luke 6:20-26","firstReadingRef":"1 Corinthians 7:25-31","secondReadingRef":"","psalmRef":"Psalm 45:11-12, 14-15, 16-17","gospelRef":"Luke 6:20-26","lectionaryKey":"2026-09-09:1 Corinthians 7:25-31||Psalm 45:11-12, 14-15, 16-17|Luke 6:20-26"}
