{"date":"2026-10-23","quote":"Why do you not judge for yourselves what is right?","quoteCitation":"Luke 12:57","firstReading":"Paul appeals to the baptized to live in a way worthy of God’s call. Such a life is marked by humility, gentleness, patience, and loving forbearance. Believers must diligently safeguard the Spirit-given unity established in peace. Paul grounds this appeal in the Church’s confession: one body, one Spirit, one hope, one Lord, one faith, one baptism, and one God and Father of all.","secondReading":"","psalmSummary":"Psalm 24 proclaims that the whole earth belongs to the Lord, who founded it securely. It asks who may enter the Lord’s holy place and answers: those whose hands are clean and whose hearts are pure, who do not turn toward what is false. Such worshipers receive blessing and vindication from God. The psalm portrays true approach to God as reverent, morally wholehearted, and faithful.","gospelSummary":"Jesus rebukes the crowds for their ability to read signs in the sky while failing to recognize the spiritual meaning of the present moment. He summons them to discern what is right and to seek reconciliation before appearing before a judge. The image is urgent: unresolved conflict can lead to judgment and loss. Christ’s teaching is not an invitation to anxious calculation but a summons to repent, make peace, and respond faithfully to God’s visitation.","saintReflection":"Saint John of Capistrano (Optional Memorial): Saint John of Capistrano (1386–1456) trained in law and served in civic life before imprisonment became a turning point leading him to the Franciscan Order. As a priest of the Observant reform, he embraced poverty, preached repentance across Europe, promoted renewal within his order, and undertook difficult missions for the Church. His era was marked by political conflict, religious polemic, and warfare, and some of his actions toward Jewish communities reflect grave prejudices that must not be repeated or excused. Veneration of a saint does not require approval of every historical judgment; holiness is received through grace amid real human limitation. John's zeal can fruitfully call the Church to conversion, disciplined prayer, and courageous proclamation, while honest remembrance also demands rejection of coercion and contempt. Christian truth must always be witnessed in charity and respect for human dignity.","dailyPrayer":"Lord Jesus Christ, you call your Church to walk worthily of the grace we have received. Grant us humility rather than self-assertion, gentleness rather than harshness, patience rather than resentment, and the love that bears with others in truth. Preserve among us the unity that your Holy Spirit has given, so that our confession of one Lord, one faith, and one baptism may be made visible in peaceful communion.\n\nPurify our hands and hearts as we come before you. Teach us to read the signs of this present time through the light of your Gospel, neither delaying conversion nor turning away from reconciliation. Where we have injured another, give us courage to seek peace; where we cling to falsehood or contempt, lead us into repentance.\n\nThrough the intercession of Saint John of Capistrano, grant your people disciplined prayer and bold witness. Keep us from every form of coercion, prejudice, and disdain. May we proclaim your truth with charity, honor the dignity of every person, and await your judgment with trust in your mercy. Amen.","theologicalSynthesis":"The readings join ecclesial communion, moral purity, and urgent conversion. Ephesians teaches that Christian unity is not a human arrangement but the fruit of the one Spirit and the one baptism that incorporate believers into Christ. This unity nevertheless asks for dispositions that correspond to grace: humility, gentleness, patience, and peace. Psalm 24 shows that nearness to God cannot be separated from integrity of life; the worshiper seeks the Lord with clean hands and a pure heart. In Luke, Jesus presses this integrity into the present moment. To recognize God’s coming in Christ requires more than observing outward signs; it requires judging rightly, turning from sin, and pursuing reconciliation. Saint John of Capistrano’s memory sharpens this summons. Zeal for renewal and proclamation must remain subject to the Gospel’s demands of charity and human dignity. The Church’s holiness is genuine not when it overlooks human failure, but when grace continually calls its members to repentance, truth, mercy, and peace.","exegesis":"Context: Ephesians 4 begins the letter’s sustained moral exhortation after its proclamation of God’s saving purpose in Christ. Paul does not present conduct as a way of earning divine favor. Rather, he calls those already summoned by God to let their manner of life correspond to that calling. The first virtues he names are notably communal: humility, gentleness, patience, and bearing with one another in love. They are not ornamental qualities. They are concrete forms of obedience by which Christians refuse the pride, aggression, and impatience that wound communion. The appeal is addressed to a people gathered by grace, not to isolated seekers of private religious achievement.\n\nContext: The unity Paul commands believers to preserve is already the work of the Holy Spirit. Christians do not create the Church’s deepest unity; they receive it in Christ and are responsible for guarding it through the bond of peace. The sevenfold confession of one body, Spirit, hope, Lord, faith, baptism, and God the Father gives this exhortation its theological foundation. Unity is rooted in the triune God and in incorporation into Christ. Therefore, division among the baptized is never spiritually trivial. Peace is not mere avoidance of conflict, but the reconciliation that allows the Church to manifest the communion God has given.\n\nPsalm: Psalm 24 moves from the Lord’s universal sovereignty to the question of access to his holy place. Because the earth and all who dwell in it belong to God, worship cannot be reduced to an outward approach to a sacred site. The psalm describes the fitting worshiper through clean hands and a pure heart, rejecting falsehood and deceit. This language joins external action and inward intention. God desires the whole person: deeds shaped by justice and a heart directed toward him without duplicity. The promised blessing is not a reward detached from grace; it is the gift of the God who welcomes those who seek his face in truth.\n\nGospel: In Luke, Jesus observes that people can draw practical conclusions from the appearance of clouds and winds, yet they fail to discern the spiritual significance of the time standing before them. The issue is not an inability to notice events. It is a failure to recognize that Jesus’ ministry confronts them with God’s saving and judging presence. The present time calls for decision. His appeal to judge what is right directs hearers toward moral discernment illumined by God’s reign. The Gospel refuses spiritual delay. When God calls, repentance cannot be postponed as though there will always be another occasion to answer.\n\nGospel: Jesus then uses the image of adversaries on the way to a magistrate. The force of the image lies in its urgency: reconciliation should be pursued before a matter reaches judgment. Read within Luke’s summons to conversion, the teaching exposes the danger of remaining hardened, unreconciled, or indifferent before God. It also has an immediate fraternal implication. The disciple who seeks the kingdom cannot casually preserve hostility or evade the demands of justice. Reconciliation is not sentimentality, nor does it excuse wrongdoing. It is the serious labor of turning from sin, seeking peace, and placing oneself under the mercy and truth of God.\n\nSaints: Saint John of Capistrano’s life, as received in the supplied account, bears the marks of conversion, Franciscan poverty, preaching, and reform. His zeal can encourage disciplined prayer and courageous proclamation in a Church always summoned anew to repentance. Yet Christian remembrance must be truthful. The profile recognizes that some of his actions toward Jewish communities reflected grave prejudices that cannot be excused or repeated. This honest judgment is not opposed to veneration; it confesses that holiness is grace at work amid genuine human limitation. Ephesians and Luke provide the needed measure: zeal must serve unity, humility, peace, repentance, and charity rather than coercion or contempt.\n\nToday: The readings call the Church to examine both its confession and its practice. To profess one faith while nurturing bitterness, falsehood, or disregard for another’s dignity contradicts the unity bestowed in baptism. To seek God’s holy presence while refusing purity of heart distorts worship. To recognize worldly signs while ignoring the Gospel’s call to conversion is spiritual blindness. Today’s path is clear: receive the Church’s unity as a gift, guard it through humble love, seek reconciliation without delay, and approach God with integrity. Christian proclamation must be clear and courageous, but it must also bear the recognizable form of Christ’s mercy, honoring every human person and rejecting all hatred.","tags":["saint-john-of-capistrano","saints","ordinary-time","christian-unity","repentance","reconciliation","psalm-24","luke-12"],"usccbLink":"https://bible.usccb.org/bible/readings/102326.cfm","cycle":"Year A","weekdayCycle":"Cycle II","feast":"Optional Memorial","gospelReference":"Luke 12:54-59","firstReadingRef":"Ephesians 4:1-6","secondReadingRef":"","psalmRef":"Psalm 24:1-2, 3-4ab, 5-6","gospelRef":"Luke 12:54-59","lectionaryKey":"2026-10-23:Ephesians 4:1-6||Psalm 24:1-2, 3-4ab, 5-6|Luke 12:54-59"}
