{"date":"2026-09-03","quote":"All things are yours; you belong to Christ indeed","quoteCitation":"Corinthians 3: 18-23","firstReading":"Paul warns against worldly wisdom and pride, urging believers not to be wise in their own conceit. He reminds the community that nothing ultimately belongs to human leaders: Paul, Apollos, and Cephas are servants through whom the community came to faith. All things—including life and death, present and future—belong to the community because they belong to Christ, and Christ belongs to God. The passage calls for humility and recognition of God’s authority.","secondReading":"","psalmSummary":"Psalm 24 proclaims God’s universal kingship: the earth and all within it belong to the Lord. It then asks who may approach God’s holy place and answers: those with clean hands and pure hearts who do not lift up their souls to falsehood. Such people receive blessing and vindication and stand in God’s presence. The psalm links divine ownership with moral integrity and worthiness to enter God’s sanctuary.","gospelSummary":"In Luke 5:1-11 Jesus teaches from Simon Peter’s boat, then instructs Peter to cast nets despite a fruitless night. The resulting miraculous catch overwhelms them with fish and amazement. Peter recognizes his unworthiness and falls at Jesus’ knees, while James and John are similarly astonished. Jesus reassures them and issues the vocational call: from now on they will fish for people. They leave everything, following him. The story combines authority, repentance, and decisive discipleship.","saintReflection":"Saint Gregory the Great (Memorial): Saint Gregory the Great (c. 540–604) entered monastic life before being called to serve as Pope from 590 to 604. Amid conflict and widespread suffering, he cared for the poor, sought peace, and supported the proclamation of the Gospel beyond Rome. His Pastoral Rule teaches that those entrusted with souls must first be attentive to their own conversion, while his commentaries on Job and the Gospels join careful interpretation of Scripture to the practice of virtue. For Gregory, knowledge of God's word remains incomplete unless it becomes humility, repentance, and charity. Contemplation and pastoral service therefore belong together: love received in prayer must become compassionate attention to others. Gregory leaves a searching question: is faith merely spoken or genuinely lived, and is worship forming a heart willing to serve with patience, discernment, and reverence for God?","dailyPrayer":"Lord Jesus, you who teach with authority and call ordinary people to extraordinary mission, grant us eyes to see our need and hearts ready to respond. When we are tempted to trust in our own wisdom or in the securities of this world, remind us that all things are yours and that we belong to you. Cleanse our hands and purify our hearts so we may stand in your presence. Give us the courage to leave what holds us back and to follow you in service and love. Make us faithful fishers of people, signs of your kingdom. Through Christ our Lord. Amen.","theologicalSynthesis":"Today’s readings intersect around the themes of ownership, humility, and call. Paul exposes the folly of human pretensions to wisdom and reminds the community that ultimately everything—leaders, gifts, and life itself—belongs to Christ and God. The psalm frames belonging in moral terms: approaching God requires clean hands and a pure heart. Luke’s narrative shows how encounter with Jesus produces repentance and vocational reorientation: Peter abandons his nets to follow. Together they teach that true wisdom is humble dependence on God and that discipleship reorders priorities toward mission.","exegesis":"Context: Paul’s words in 1 Corinthians 3:18–23 come within a community fractured by factionalism and rival loyalties to different leaders. Paul diagnoses a deeper problem: the Corinthians’ claim to worldly wisdom and status blinds them to the central truth that ministry is God’s work, not a human proprietorship. By insisting that ‘‘you belong to Christ, and Christ to God,’’ Paul redirects the community from affiliation with personalities toward common belonging in the triune economy. The passage confronts pride with the theological claim that all distinctions ultimately stand under God’s sovereignty.\n\nPsalm: Psalm 24 responds to this theological horizon by asserting divine ownership of creation—‘‘The earth is the Lord’s’’—and then asking who may stand in God’s holy place. The psalm’s answer centers not on cultic pedigree but moral integrity: clean hands and a pure heart, one who has not sworn deceitfully. The psalm therefore ties cosmic lordship to ethical demands: belonging to God requires moral transformation. This moral prerequisite resonates with Paul’s correction of misplaced confidence and prepares the believer for genuine encounter with the Lord.\n\nGospel: Luke 5:1–11 dramatizes what authentic encounter looks like. Jesus’ teaching from Peter’s boat establishes his authority, then his command to cast the nets despite failure reveals a providential reversal. The miraculous catch provokes Peter’s humility—‘‘Go away from me, Lord; I am a sinful man’’—and Jesus’ call reframes Peter’s identity: not merely a fisherman but a ‘‘fisher of men.’’ The narrative links confession, reassurance, and vocational summons, showing that meeting Jesus produces both repentance and mission.\n\nSaints: Saint Gregory the Great joins the contemplation of Scripture to the conversion required of those who teach and serve the Church. His Pastoral Rule insists that care for others must be accompanied by humility and attention to one's own spiritual life. This teaching accords with Paul's rejection of boasting in human wisdom and with the psalm's demand for purity before God. In the Gospel, Peter acknowledges his sinfulness and receives Christ's call; Gregory's witness likewise directs pastoral authority toward obedience to Christ rather than self-exaltation. His care for the poor and proclamation of the Gospel show how prayer becomes charity. The memorial therefore invites the Church to receive God's word with repentance and to express that faith in patient, compassionate service.\n\nTheology: Theologically these texts converge on the priority of God’s lordship over human ambition. Paul’s anti-elitism, the psalm’s moral requisites, and Luke’s vocational encounter together reject status as the measure of spiritual worth. Belonging to Christ entails both a reappraisal of what is ‘‘ours’’ and an ethical response—purity of heart and readiness to serve. Moreover, the call to discipleship is not an individualistic charisma but a communal reorientation: the community as a whole is invited into God’s stewardship and mission.\n\nToday: For contemporary believers these readings provoke questions about where we place our confidence and how we respond to Christ’s summons. Do we measure worth by success, knowledge, or influence, or by belonging to Christ? The psalm urges an examination of conscience, while Luke’s story challenges us to risk leaving professions of security for mission. Practically, the texts encourage humility, communal accountability, and a pastoral imagination that forms Christians as persons of clean hands and pure hearts who are ready to follow and to lead others to Christ.","tags":["saint-gregory-the-great","saints","conversion","call","discipleship","humility","peter","mission","stewardship","holiness"],"usccbLink":"https://bible.usccb.org/bible/readings/090326.cfm","cycle":"Year A","weekdayCycle":"Cycle II","feast":"","gospelReference":"Luke 5: 1-11","firstReadingRef":"1 Corinthians 3: 18-23","secondReadingRef":"","psalmRef":"Psalms 24: 1bc-2, 3-4ab, 5-6","gospelRef":"Luke 5: 1-11","lectionaryKey":"2026-09-03:1 Corinthians 3: 18-23||Psalms 24: 1bc-2, 3-4ab, 5-6|Luke 5: 1-11"}
